text,label
이 회의록 요약 분석해줘,ANALYSIS
네 알겠습니다 지금 바로 확인해 보도록 할게요 고마워요,CASUAL
아니야 그런,CASUAL
서버 비용 절감을 위해서 인스턴스 사양을 낮추는 게 맞을까요,ANALYSIS
지금 현재 금 시세 변동 추이 그래프 상세히 보여줘,SEARCH
푸시 알림 발송 횟수가 앱 삭제율에 미치는 임계 지점 찾아봐,ANALYSIS
파이썬으로 구글 캘린더 일정 추가하는 API 활용 기초 코드 짜쥬,GENERATION
메인 페이지 개편 후 유입 대비 이탈률 변화 분석해,ANALYSIS
캐나다에서 온 메일을 읽었니,SEARCH
네 알겠습니다 그럼 나중에 다시 톡 드릴게요,CASUAL
미국 독립 전쟁 이후 연방 헌법 제정 과정은?,QUESTION
오 그렇군요 새로운 시각이네요 좋은 말씀 감사합니다,CASUAL
코드 리뷰 때 컨벤션 지적 줄이려면 어떤 가이드라인이 필요할까,ANALYSIS
지금 현재 내 위치 근처 편의점 택배 가격 검색해바,SEARCH
아님 가만 안 있는다,CASUAL
올해 여름 휴가 가기 좋은 수영장 있는 펜션 ㅊㅊ,SEARCH
주식 시장의 '윈터 랠리'의 발생 원인은?,QUESTION
지금 현재 멜론 차트 상위권 노래 리스트,SEARCH
오 그렇군요 몰랐던 정보인데 감사합니다 잘 알겠어요,CASUAL
눈 충혈됐을 때 냉찜질이 더 좋아?,QUESTION
서브프라임 모기지 사태의 직접적인 원인이 된 금리 변동은?,QUESTION
데이터베이스 관리 시스템(DBMS)의 성능 향상을 위한 수직적 확장(Scale-up) 기술이 기존 서버의 CPU나 메모리 같은 하드웨어 자원을 업그레이드하여 단일 장비의 처리 능력을 높이는 구체적인 방식과 이 방식이 분산 환경의 수평적 확장(Scale-out) 대비 갖는 운영상의 장점은 무엇이야?,QUESTION
역사학자들이 사료를 분석할 때 필자의 정치적 입장이나 사회적 배경이 기록의 왜곡을 일으키는 구체적인 사례는?,QUESTION
네 잘 알겠습니다 그럼 오늘도 수고 많으셨고 즐거운 퇴근길 되시길 바랄게요 내일 또 웃는 얼굴로 뵙겠습니다,CASUAL
정말 화났,CASUAL
헬스장 혼잡 시간대 분석해서 이용권 등급제로 나누는 거 검토,ANALYSIS
요즘 핫한 한남동 카페 거리 리스트 알려쥬,SEARCH
우리 서비스가 경쟁사보다 로딩 1초 느린 게 이탈에 끼치는 영향 분석,ANALYSIS
A 제품이랑 B 제품에 대한 소비자 반응이 작년이랑 어떻게 달라졌는지 차이점 정리해줘,ANALYSIS
묻지마 장세의 시작인 것 같은 조짐도 있네요,CASUAL
이 메일에 답장을 보냈는지 확인해줘,SEARCH
십자군 전쟁의 긍정적인 결과가 있어?,QUESTION
요즘 인기 있는 요가 매트 가방 브랜드 ㅊㅊ,SEARCH
안방만 에어컨 켜줘,GENERATION
지금 현재 골드만삭스 리포트 주식 전망 어때?,SEARCH
올해 수능 등급표 나왔어?,SEARCH
생리통 심할 때 먹으면 좋은 음식 알려쥬,QUESTION
리눅스 파일 권한 755가 무슨 뜻이야?,QUESTION
이게 연출 공부하라니까 베끼기 공부를 하고 너 생각이 있어 없어 새끼야,CASUAL
유저들이 앱 삭제하기 전에 마지막으로 머문 페이지의 특징 분석해,ANALYSIS
예약은 바다가 보이는 방이다,GENERATION
보일러 좀 틀어줄 수 있니,GENERATION
백엔드 API 응답 결과값이 프론트엔드 명세서랑 다른 부분 다 찾아서 분석해바,ANALYSIS
강남 근처 카페 ㅊㅊ,SEARCH
인프라를 코드로 관리하는 테라폼의 장점이 뭐야?,QUESTION
저도 열심히줄을서서 먹어 보았답니다,CASUAL
파이썬 파일 확인 코드 써쥬,GENERATION
하이 지석님 자리에 계셔? 있으면 메신저 좀 봐줘,QUESTION
안구건조증 예방 습관 알려쥬,QUESTION
CSS 애니메이션으로 요소 크기 커졌다 작아졌다 하는 소스 알려줘,GENERATION
그러게 왜 전활 받아,CASUAL
가을인데 왜 이렇게 비가 많이 오지,CASUAL
오늘 체감온도 어때,SEARCH
아 근데 이거 원래 이래?,QUESTION
SQL로 부모-자식 관계 데이터 계층형으로 조회하는 쿼리 짜줘,GENERATION
근처에 평점 좋은 정형외과 도수치료 잘하는 곳 어디야?,SEARCH
사내 동호회 신규 개설 제안서 양식 항목 맹들어바,GENERATION
넵 확인했습니다 이따가 자리로 가겠습니다 감사합니다,CASUAL
네가 산 주식이 너무 안정적이라서 오히려 역효과 날 것 같아,CASUAL
내일 비 오는지 알려줘,SEARCH
교수님 메일 주소 좀 알려줄 수 있니,SEARCH
홈페이지 하단에 들어갈 개인정보 처리방침 기본 양식 맹들어줘,GENERATION
이 성과 지표 보고서 내용이 통계적 유의미성(p-value)을 확보했는지 전문가 관점에서 분석해바,ANALYSIS
이 코드에서 발생하는 컴파일 오류 원인이 라이브러리 버전 문제인지 로직 문제인지 분석해줘,ANALYSIS
넌 만능 스포츠맨이잖니 난 아니야,CASUAL
동료 승진 축하 노고 찬사 메시지 작성해줘,GENERATION
공매도 세력이 주가 급등 시 숏 커버링을 시작하는 임계점은?,QUESTION
요즘 유행하는 인스타 릴스 챌린지 뭐야?,SEARCH
열두시에 불 꺼줄 수 있니,GENERATION
사내 보안 강화 캠페인 영상 시청 독려 맹들어쥬,GENERATION
HTML 태그로 웹 문서의 탐색 바 정의하는 소스 알려줘,GENERATION
이번 달에 부산에서 있었던 일정을 확인하렴,SEARCH
주류운반이 허가된 차량입니다,CASUAL
서울에서 가장 분위기 좋은 재즈 바는 어디일까,QUESTION
자바스크립트 배열 구조 분해 할당 실전 예제 코드 짜바,GENERATION
내일 일정이 몇 개니,SEARCH
지난주 삼계탕 미팅 장소가 어디였지,QUESTION
지금 현재 네이버 웹툰 실시간 인기 순위 리스트 요약해줘,SEARCH
오늘의 날씨랑 공원 산책하기 좋은 날인지 상세히 알려줘,SEARCH
미팅 시간 단축 후 팀원들의 실제 업무 집중도 변화 분석해줄래,ANALYSIS
오늘 프로야구 선발 투수 명단 알려줘,SEARCH
속 쓰릴 때 마셔도 되는 차 추천해줘,QUESTION
올림픽 국가별 순위 관련 기사를 찾아,SEARCH
눈 다래끼 났을 때 기름진 음식 먹으면 안 돼?,QUESTION
파이썬 딕셔너리 키 값 서로 바꾸기 코드 써쥬,GENERATION
우주 공간에서는 근육이 줄어들어?,QUESTION
지금 핫한 밈 뭐야,SEARCH
소녀가 자신을 버린 아버지를 찾겠다고 말할 때마다,CASUAL
지금 현재 내 위치 주변 카페 조용한 곳 검색해바,SEARCH
매출 왜 이럼?,ANALYSIS
손절매가 주식 투자에서 왜 중요해?,QUESTION
파이썬 텍스트 리스트 읽기 코드 써쥬,GENERATION
이거 가능성 있어?,ANALYSIS
달의 뒷면이 우리가 항상 마주하는 앞면과 비교했을 때 거대한 현무암질 평원인 '바다' 지형이 현저히 적고 수많은 충돌구로 뒤덮여 있으며 지각의 두께도 앞면보다 훨씬 더 두꺼운 지질학적 비대칭성의 원인을 설명하는 최신 천문학적 가설을 제시해주고 특히 초기 지구와 달이 매우 가까웠던 시절 지구가 방출한 엄청난 양의 복사열이 조석 고정 상태인 달의 앞면 온도를 높게 유지시켜 지각 형성을 방해한 반면 뒷면은 상대적으로 빠르게 식으면서 더 두꺼운 지각을 형성하게 되었다는 '비대칭 냉각 가설'의 과학적 근거를 상세히 설명해주며 최근 중국의 창어 4호나 인도의 찬드라얀 3호 같은 우주 탐사선들이 뒷면 착륙을 통해 수집한 최신 데이터들이 달의 기원과 진화 과정을 이해하는 데 어떠한 새로운 통찰을 제공하고 있는지 알려줘,QUESTION
자바스크립트 템플릿 리터럴 예제 코드 짜바,GENERATION
근처에 평점 좋은 내과 위염 치료 잘하는 곳 어디야?,SEARCH
거래처에 보낼 상품 견적 문의 및 자료 요청 메일 써바,GENERATION
PBR 수치가 낮으면 주식이 저평가된 거야?,QUESTION
오늘 야구 누가 이김?,SEARCH
오늘의 증시 현황 요약해서 알려쥬,SEARCH
사내 교육 공지 맹들어쥬,GENERATION
서브프라임 모기지 사태의 직접적인 피해를 입은 국가들은?,QUESTION
거북이 수명이 긴 이유가 뭐야?,QUESTION
할머님이 위독하시다 빨리 와,GENERATION
오늘 점심 때 로비에서 십분 일찍 봐요,GENERATION
근처에 평점 높은 샐러드 맛집 배달 가능한 곳 어디 있어?,SEARCH
시나리오,CASUAL
형 요즘도 주유차 타세요 기름 값 많이 올랐죠,SEARCH
서울 가볼 만한 전시회 추천해줘,SEARCH
우리 회사 로고에 어울리는 슬로건 '기술'과 '사람' 넣어서 만들어줘,GENERATION
오늘의 주요 패션 트렌드 뉴스 요약해줘,SEARCH
카페테리아 간식 품목 바꿨을 때 직원들 만족도 변화 분석해줄래,ANALYSIS
오늘의 주요 장르 소설 뉴스 정리해줘,SEARCH
영문 메일 확인 바란다 5개 써줘,GENERATION
전사 체육대회 대진표 맹들어바,GENERATION
오늘 우산을 챙겨야 되는지 확인해,QUESTION
식물이 외부 침입자나 환경 변화에 대응하기 위해 휘발성 유기 화합물을 방출하여 주변 식물에게 위험을 알리는 메커니즘은 무엇이야?,QUESTION
오늘의 날씨랑 초미세먼지 마스크 착용 권장 여부 알려줘,SEARCH
그저께 일정 알려줄 수 있니,SEARCH
오늘의 달러 환율이랑 위안화 환율 비교해줘,SEARCH
자바스크립트 배열을 쉼표로 구분된 문자열로 변환하는 예제 코드 짜바,GENERATION
너무 걱정 마세요,GENERATION
근처에 평점 좋은 내과 내시경 잘하는 곳 어디야?,SEARCH
우리 회사 슬로건 후보군 5개랑 각각의 브랜드 소구점 정리해바,GENERATION
기술 블로그 운영하는 게 채용 지원자 수에 영향 주나,ANALYSIS
나랑 같이 스쿼시 배우러 다니자,GENERATION
본 제품 사용 시 운전이나 보행은 매우 위험합니다,GENERATION
어제 강수량 얼마였는지 보여주라,SEARCH
항상 성실한 모습 보기 좋습니다 오늘도 화이팅하세요,CASUAL
안됐구나 요즘 주식 잘 안되지,CASUAL
전사 체육대회 조별 이름이랑 구호 재치 있게 5개씩 맹들어바,GENERATION
비행기 창문의 작은 구멍을 통해 압력이 조절되는 원리는?,QUESTION
전사 체육대회 대진표 확정 공지 및 응원가 맹들어바,GENERATION
오늘의 날씨랑 야외 촬영하기 좋은 곳 알려줘,SEARCH
메일에 내 전화번호도 같이 보내줘,GENERATION
자바 가비지 컬렉션의 G1 GC가 뭐야?,QUESTION
무좀 균은 왜 잘 안 죽어?,QUESTION
동호회 참여가 직원들의 직무 스트레스 해소에 실질적 도움 되는가 봐,ANALYSIS
주식 시장에서 '검은 월요일'이 뭐야?,QUESTION
이 계약 조건 협상 포인트 분석해줘,ANALYSIS
우리 회사 사내 방송 오프닝 멘트 활기차게 지어바,GENERATION
팀원들에게 보내는 금요일 활기찬 주말 인사 메시지 작성해줘,GENERATION
오늘의 스포츠 이슈 뉴스 알려쥬,SEARCH
오늘의 주식 시장 기관 매수 종목 뭐야?,SEARCH
전사 야유회 투표 공지 맹들어바,GENERATION
CSS 애니메이션으로 텍스트 타이핑 효과 주는 소스 알려줘,GENERATION
내일 미세먼지 농도가 얼마야,SEARCH
HTML target 소스 알려줘,GENERATION
근처에 평점 좋은 내과 위내시경 검진 비용 어디야?,SEARCH
지금 날씨가 흐린지 알아봐,SEARCH
보호무역주의의 확산이 각국 간의 글로벌 가치 사슬 연계성을 약화시키고 공급망의 지역화 또는 리쇼어링을 촉진하는 거시 경제적 배경 분석해쥬,QUESTION
지금 현재 내 위치 주변 데이트 장소 추천해바,SEARCH
비즈니스 감사 메일 써줘,GENERATION
정말 감사합니다 덕분에 해결할 수 있었어요 최고예요,CASUAL
메모리 관리 기법 중 페이징의 외부 단편화 문제 해결 방법은?,QUESTION
지금 대구 기온 알려줘,SEARCH
여자친구 생일이 양력으로 몇 월 며칠이야,QUESTION
사내 헬스장 이용객이랑 직원들 연차 사용 횟수 상관관계 분석해봐,ANALYSIS
난 정말루 어머님 작품이 좋아,CASUAL
친구한테 온 메일수신 확인 부탁해도되니,GENERATION
비즈니스 기획서 표지 디자인에 들어갈 제목 써줘,GENERATION
비즈니스 제안서에 들어갈 시장 규모 예측 문장 써줘,GENERATION
우리 앱 아이콘 색감 바꾼 거 스토어 전환율에 유의미한 영향 줬나,ANALYSIS
지금 비 올 확률이 몇 퍼센트인지 알려줘,SEARCH
목 디스크 초기 증상을 겪고 있는 환자가 일상적인 재활 운동 과정에서 경추의 정렬을 바르게 유지하고 주변 근육을 강화하기 위해 실내에서 안전하게 사용할 수 있는 목 견인기나 스트레칭 밴드 같은 운동 보조 기구의 종류별 장단점과 올바른 사용 시 주의 사항 알려바,QUESTION
특정 시간대 서버 접속 지연이 DB 커넥션 풀 부족 때문인지 확인해,ANALYSIS
도서관 이용 실태 분석해서 인기 없는 카테고리 정리해,ANALYSIS
세탁기 탈수 진행해줘,GENERATION
데드락 회피를 위한 은행가 알고리즘에서 시스템이 '안전 상태'에 있다는 것을 증명하는 단계별 절차는?,QUESTION
그 종목의 숨겨진 리스크가 있지 않을까,QUESTION
중요보관함에 이메일이 몇 개가 있니,SEARCH
우리 서비스 내 장바구니 상품 추가 안내 멘트 지어바,GENERATION
오늘의 주식 시장 코스닥 기관 매수 종목 뭐야?,SEARCH
지금 현재 원달러 환율 살 때 팔 때 수수료 얼마야?,SEARCH
사내 분위기가 창의적인 아이디어 내기에 적합한지 평가,ANALYSIS
삼십분 뒤에 히터 틀어줘,GENERATION
저번주 월요일부터 일요일까지 온 메일 중 안 읽은 메일 확인해줘,GENERATION
티브이 음소거좀 해줄 수 있어,GENERATION
내년 매출 목표 달성하려면 지금 유입 경로 어디를 더 뚫어야 해,ANALYSIS
아무튼 다음에 기회 되면 한번 만나요,GENERATION
우리는 곧바로 선착장으로가서 유람선을 기다렸다,CASUAL
우리 서비스 유저 피드백 분석해바,ANALYSIS
풍선 효과가 대출 규제 정책에서 주택 담보 대출 규제 시 신용 대출이나 보험사 대출이 급증하여 가계 부채 총량 관리에 어려움을 주는 경제적 파급 효과는?,QUESTION
함수형 프로그래밍의 1급 함수(First-class Function) 특징이 변수에 함수를 저장하거나 인자로 전달하는 설계에 주는 이점은?,QUESTION
손발 저림 증상을 완화하고 혈액순환을 개선하는 데 탁월한 효과가 있는 음식과 영양제 추천해바,QUESTION
분석 결과 어떰?,ANALYSIS
채용 중인 직군 지원자 수가 작년 대비 줄어든 원인 분석해줘,ANALYSIS
아침 여섯시 삼십분에 이 번 시디로 켜,GENERATION
모레 영화 보기로 한 거 강남역 맞지,QUESTION
이메일 초안 작성해줘,GENERATION
지금 현재 내 위치 주변 카페 작업하기 좋은 곳 검색해바,SEARCH
협력사에 보낼 계약 조건 변경에 대한 긍정적인 검토 요청 메일 써바,GENERATION
사내 일회용품 사용 금지 캠페인 공지 및 대안 안내 맹들어쥬,GENERATION
오늘의 날씨랑 안개 주의해야 하는지 알려줘,SEARCH
고구려 소수림왕의 업적이 뭐야?,QUESTION
경쟁사 3곳의 올해 신제품 기능 비교표 만들어줘,ANALYSIS
이 에러 뭐야,QUESTION
요번 주 전국 날씨 어떻게 되지,SEARCH
우리 팀 회의 시간 줄이면 개발 집중 시간 얼마나 늘까,ANALYSIS
지금 현재 내 위치 근처 코인 세탁소 어디 있어?,SEARCH
오늘 날씨가 꾸물꾸물하네요 그래도 마음만은 맑게 화이팅,CASUAL
코드 리뷰 퀄리티가 이전 프로젝트보다 좋아졌는지 판단해봐,ANALYSIS
우리 서비스 앱 런칭 축하 영상 대본 지어바,GENERATION
오늘 허리가 너무 아프네 비가 올려나,CASUAL
동호회 지원금 인상하면 참여율이 지금보다 15% 이상 올라갈까 예측,ANALYSIS
그때 어긴 약속 때문에 내내 마음에 걸렸어,CASUAL
CSS 필터 효과(filter: grayscale) 세련되게 넣는 소스 알려줘,GENERATION
자바 다형성 구현 예제 코드 짜바,GENERATION
메인 화면 배너 위치 바꾼 후 클릭당 매출 얼마나 변했는지 분석해줘,ANALYSIS
그렇군요 좋은 정보 알려주셔서 감사합니다 덕분에 잘 알게 되었어요,CASUAL
환율 상승이 수입차 가격에 미치는 영향은?,QUESTION
와 정말 예쁘네요 사진 보니까 저도 가고 싶어지네요 대박,CASUAL
오늘나의 비밀 장소 공개한거야 다음에 또가자,GENERATION
겨울에 입술 트는 거 예방하는 법 알려쥬,QUESTION
물 다 잠겨 있는 지 확인해줄 수 있니,SEARCH
넵 확인했습니다 나중에 뵙겠습니다,CASUAL
리액트 Suspense로 데이터 로딩 처리하는 예제 코드 써쥬,GENERATION
주식 시장의 '윈터 랠리'가 뭐야?,QUESTION
엔비디아 주가 어제 얼마나 올랐어?,SEARCH
오늘의 날씨랑 한강 피크닉 하기 좋은 날인지 알려줘,SEARCH
기회비용이 경제학에서 무슨 뜻이야?,QUESTION
SQL 특정 열 합계 0 행 제외 쿼리 짜바,GENERATION
인공지능 할루시네이션 현상이 왜 발생해?,QUESTION
회의록 작성 자동화 툴 도입 후 관리자 업무 시간 변화 분석해줘,ANALYSIS
하늘 색깔이 파란 이유를 레일리 산란으로 설명해줘,QUESTION
앱 삭제 직전에 유저들이 공통적으로 이용한 기능 분석,ANALYSIS
사내 에너지 절약 실천 수칙 및 참여 혜택 공지 맹들어쥬,GENERATION
파이썬으로 텍스트 파일 모든 내용 리스트 읽기 코드 써쥬,GENERATION
유산균을 공복에 먹어야 하는 이유가 뭐야?,QUESTION
애 때문이다,CASUAL
마케팅 데이터 중 허수 유입 제외하고 실제 효율 봐줘,ANALYSIS
이 ETF 괜찮을까,ANALYSIS
야근하는 팀원들에게 보내는 고마움 가득한 간식 배달 메시지 작성해줘,GENERATION
사내 개인정보 보안 캠페인 완료 공지 및 우수 부서 발표 맹들어쥬,GENERATION
오늘 출근길 장난 아니었습니다,CASUAL
침실에 불 꺼,GENERATION
주식 무상 증자가 주주에게 호재인 이유가 뭐야?,QUESTION
HTML 하이퍼링크 밑줄 없애는 CSS 소스 알려줘,GENERATION
밀리면서 상동 에 죽돌이 가되어가고 있는 모습도 보기 안타깝다,CASUAL
파이썬으로 웹 크롤링해서 제목만 뽑아오는 기초 코드 짜줘,GENERATION
미라를 만든 이유가 뭐야?,QUESTION
내일 기온 몇 도까지 올라가? 옷 어케 입을지 알려줘,SEARCH
언제 지금 내리는 비가 그칠까,QUESTION
현재 실내 온도 알려줄 수 있니,SEARCH
태풍이 이곳을 지나가는지 경로가 어떻게 돼,QUESTION
데려다 줘서 고마워요,CASUAL
회사 블로그 운영하는 게 채용 홍보에 실질적 도움 됨,ANALYSIS
지금 현재 테슬라 주가 반등 가능성 분석 기사,SEARCH
비염 완화에 좋은 코 세척법 알려줘,QUESTION
최근 트렌드 요약 분석해쥬,ANALYSIS
선배 내가 일이 있어서 그래 우리 낼 보자,GENERATION
대상포진 전염성 있어?,QUESTION
주식 유상 증자가 주가에 미치는 영향이 뭐야?,QUESTION
나한테 완전 실망했겠다,CASUAL
와 진짜 부러워요 저도 나중에 기회가 되면 꼭 가보고 싶네요 사진 공유해 주셔서 정말 감사합니다 대박이에요,CASUAL
지금 현재 내 위치 주변 카페 노트북 하기 좋은 곳 검색해바,SEARCH
CSS 불투명도(alpha) 값 조절해서 배경색 입히는 소스 알려줘,GENERATION
오늘 약속 있었니,SEARCH
오늘 금값 얼마임,SEARCH
파이썬으로 웹 서버 응답 시간 체크하는 간단한 툴 코드 짜바,GENERATION
보안 규정 읽고 체크리스트로 문서화해줘,GENERATION
실크로드를 통한 동서양 교류 과정에서 중국의 종이 제작 기술이 이슬람 세계로 전파된 구체적 경로는?,QUESTION
이 문서 요약 가이드 보고 신규 브랜드 매뉴얼에 적용할 점 분석해바,ANALYSIS
십월에 방콕 강수확률 좀 알려줄래,SEARCH
우량주 투자 시 수령한 배당금을 다시 재투자할 때 발생하는 장기 수익률의 복리 효과는?,QUESTION
다크모드 지원하는 게 유저 이탈 방지에 실질적 도움 됨,ANALYSIS
SQL 쿼리 짜바,GENERATION
감기약이랑 술이랑 같이 먹으면 안 되는 의학적 이유가 뭐야?,QUESTION
안방 화장실에 조명이 꺼져있는지 확인해,SEARCH
지금 다이소에 파는 가성비 템 뭐 있어?,SEARCH
파이썬으로 리스트 내 중복 요소 제거하고 순서 유지하는 코드 짜줘,GENERATION
조선시대 암행어사가 사용한 물건들 알려주ㅔ,QUESTION
지금 현재 내 위치 근처 애견 호텔 가격 확인해바,SEARCH
주식 시장 휴장일은 언제야?,QUESTION
영문 메일에서 제안을 완곡하게 거절할 때 쓰는 표현 5개 써줘,GENERATION
이번달 인천 누적 강수량이 어떤지 아니,SEARCH
나루토 구미호 화하면 못이길게 없다,CASUAL
비행기 창문 아래 작은 구멍을 브리더 홀이라고 해?,QUESTION
요즘 카드는 할인 혜택이 많아,CASUAL
안중근 의사가 하얼빈에서 처단한 인물이 누구야?,QUESTION
요즘 핫한 연남동 카페 거리 지도 포함 리스트 알려쥬,SEARCH
스트레스 해소에 좋은 취미 알려줘,QUESTION
다음주중에 날씨가 가장 맑은 날이 언제일까,QUESTION
포장 상태도 깔끔하고 상품 상태도 잘 포장되어 왔네요,CASUAL
신라의 사정부가 오늘날의 어떤 기관과 비슷해?,QUESTION
오늘의 주요 장르 문학 뉴스 정리해줘,SEARCH
게임 회사에서 온 메일 알려 줄수 있니,SEARCH
마케팅 채널별 ROI 따져보고 예산 비중 조절해야 할 것 같아요.,ANALYSIS
이 계약서 법적 리스크 분석해줘,ANALYSIS
코드 리뷰 평균 소요 시간 보니까 팀별 편차 왜 이래,ANALYSIS
넵 확인했습니다 이따가 연락드릴게요 감사합니다,CASUAL
이번주 목요일 목포 기상 예보 보여줘,QUESTION
하늘 색깔이 노을 질 때 붉게 보이는 이유를 가시광선의 파장별 산란율 차이를 나타내는 수식 없이 설명해줘,QUESTION
사랑니 안 뽑으면 나중에 어떻게 돼?,QUESTION
아 비트코인 떡상했나?,SEARCH
오늘 도쿄 날씨 검색해줘,SEARCH
우리 서비스 앱 로딩 바 디자인에 들어갈 위트 있는 아이디어 지어바,GENERATION
감동입니다,CASUAL
협업 툴 노션으로 갈아타면 지라보다 나은 점이 뭐야,ANALYSIS
코스피 3000 시대가 갖는 의미가 뭐야?,QUESTION
A 광고 대행사랑 B 대행사가 보낸 제안서의 KPI 달성 가능성을 객관적으로 비교해쥬,ANALYSIS
전세만기 이전에 이사를 하면 복비나 이사 비를 어떻게 받아,CASUAL
지금 적금 넣을만해?,ANALYSIS
산업혁명 당시 노동자들의 삶은 어땠어?,QUESTION
리액트 Context API로 테마 변경 기능 구현하는 소스 코드 공유해줘,GENERATION
지금 교통 상황 어때,SEARCH
SQL로 데이터 그룹별로 정렬 후 순번 매기는 쿼리 짜바,GENERATION
지금 현재 내 위치 근처 세탁소 수거 배달 가능한 곳 확인해바,SEARCH
파이썬으로 텍스트 파일에서 특정 단어가 몇 번째 줄에 있는지 찾는 코드 써쥬,GENERATION
근처에 평점 좋은 한의원 비염 치료 잘하는 곳 어디야?,SEARCH
이거랑 저거 뭐가 더 괜찮아,ANALYSIS
속 쓰림 증상이 있을 때 마셔도 자극이 없는 차 종류 추천해줘,QUESTION
데이터베이스의 수직적 확장(Scale-up) 기술이 가진 성능상의 장점과 하드웨어적 한계점은 무엇이야?,QUESTION
우리 회사 공식 블로그 닉네임 후보 3개 친근하게 지어바,GENERATION
사실 모든 말이다 이렇게 순 하지는 않답니다,CASUAL
중세 유럽의 봉건 제도 하에서 토지에 결박된 채 농사를 짓던 농노(Serf)들이 비록 영주의 지배를 받는 예속적 신분이었음에도 불구하고 자신의 거주지를 보유하거나 일정 부분의 생산물을 사유화할 수 있었던 최소한의 경제적 자유와 법률적 권한의 실체는 무엇이야?,QUESTION
우리 회사 인스타 프로필 문구 지어바,GENERATION
우리 브랜드 슬로건 '가치' 키워드 지어바,GENERATION
비트코인 8천 넘었는데 살까 말까,ANALYSIS
사내 직급별 역량 강화 교육 신청 공지 맹들어쥬,GENERATION
요즘 교통경찰 들은 이런 거 안 잡고 뭐 하는 거야,CASUAL
경쟁사 앱의 신규 기능 업데이트 주기를 분석해서 걔네 개발 속도 분석 보고해줘,ANALYSIS
웹 앱이랑 하이브리드 앱 중에서 사용자 경험(UX)이 더 좋은 건?,QUESTION
현대인들이 많이 찾고 있는 손님 초대 요리 홈 밀입니다,CASUAL
네 알겠습니다 그럼 오늘도 고생 많으셨습니다 내일 봬요,CASUAL
근처에 평점 높은 에비텬동 전문점 어디 있어?,SEARCH
우리 서비스 앱 초기 화면에 보여줄 서비스 철학 지어바,GENERATION
걱정 마세요,GENERATION
오늘의 주요 건강 뉴스 요약해줘,SEARCH
할머니 빠른 쾌유를 빌게,GENERATION
사내 개인 용품 정리 캠페인 참여 안내 맹들어쥬,GENERATION
식물이 소리를 들을 수 있어?,QUESTION
푸시 알림 클릭률 높은 문구 스타일이 '정보형'인지 '감성형'인지 분석,ANALYSIS
데이터 백업 중 풀 백업(Full Backup)이 왜 제일 기본이야?,QUESTION
